<?xml version="1.0" encoding="UTF-8"?>
<transaction classpath="/engine/WEB-INF/trans_rules/classes/" evaluation="shortcut" name="fine" xmlns="http://kalio.net/empweb/schema/transaction/v1" xmlns:xsi="http://www.w3.org/2001/XMLSchema-instance" xsi:schemaLocation="http://kalio.net/empweb/schema/transaction/v1                                  ../../../../common/xml/schema/transaction/v1/empweb-transaction-1-0.xsd">
<environment>
   <!-- <param name="debug">true</param> -->
</environment>

<rule class="net.kalio.empweb.engine.rules.GetUser" name="GetUser"><params>
<!-- checks for expired or disabled user -->
<param name="checkValidity">true</param>
</params></rule>

<rule class="net.kalio.empweb.engine.rules.Lock" name="LockUserStatus">
  <doc>Logical lock of UserStatus</doc>
  <params>
    <param name="timeoutMillis">25000</param>
  </params>
</rule>

<rule class="net.kalio.empweb.engine.rules.GetUserStatus" name="GetUserStatus" />


<process class="net.kalio.empweb.engine.rules.CreateFine" name="CreateFine">
  <doc>Creates a Fine object.
       It may be a manual fine, or a fine related to a late return or expired reservation.
       The behaviour of the Process depends on the existence of a Loan or Reservation in
       the TransacionContext (in which case it will be an object-related Fine), or the
       abscence of both (in which case it will create a manual Fine)
  </doc>
  <params>
    <param name="fineKey">fine</param>
    <param name="manualFineAmountKey">fineAmount</param>
    <param name="manualType">M</param>  <!-- fine type for manual fines -->

    <!-- These two are keys into the transaction extras -->
    <param name="operatorIdExtrasKey">operatorId</param>
    <param name="operatorLocationExtrasKey">operatorLocation</param>
  </params>
</process>


<rule class="net.kalio.empweb.engine.rules.AddTransactionToStatus" name="AddFineToStatus">
  <params>
    <param name="transactionKey">fine</param>
    <param name="toObjectStatus">false</param>
  </params>
</rule>

<process class="net.kalio.empweb.engine.rules.UpdateDb" name="UpdateDb">
  <doc>Updates User/Object Status databases, and stores the Fine to transaction log.</doc>
  <params>
   <param name="transactionKeys">fine</param>
   <param name="storeUserStatus">true</param>
   <param name="storeObjectStatus">false</param>
  </params>
</process>

<process class="net.kalio.empweb.engine.rules.ReturnTransactionResults" name="ReturnTransactionResults">
  <params>
    <param name="resultKeys">fine</param>
  </params>
</process>
<finally class="net.kalio.empweb.engine.rules.Unlock" name="Unlock">
  <doc>Release the logic locks done at the beginning.</doc>
</finally></transaction>