<?xml version="1.0" encoding="UTF-8"?>
<transaction classpath="/engine/WEB-INF/trans_rules/classes/" evaluation="shortcut" name="suspension" xmlns="http://kalio.net/empweb/schema/transaction/v1" xmlns:xsi="http://www.w3.org/2001/XMLSchema-instance" xsi:schemaLocation="http://kalio.net/empweb/schema/transaction/v1               ../../../../common/xml/schema/transaction/v1/empweb-transaction-1-0.xsd">
<environment>
 <!--    <param name="debug">true</param> -->
</environment>

<process class="net.kalio.empweb.engine.rules.GetUser" name="GetUser"><params>
<!-- checks for expired or disabled user -->
<param name="checkValidity">true</param>
</params></process>

<rule class="net.kalio.empweb.engine.rules.Lock" name="LockUserStatus">
  <doc>Logical lock of UserStatus</doc>
  <params>
    <param name="timeoutMillis">25000</param>
  </params>
</rule>

<rule class="net.kalio.empweb.engine.rules.GetUserStatus" name="GetUserStatus" />

<process class="net.kalio.empweb.engine.rules.CreateSuspension" name="CreateSuspension">
  <doc>Creates a Suspension object.
       It may be a manual suspension, or a suspension related to a late return or expired reservation.
       The behaviour of the Process depends on the existence of a Loan or Reservation in
       the TransacionContext (in which case it will be an object-related Suspension), or the
       abscence of both (in which case it will create a manual Suspension)
  </doc>
  <limits>
  </limits>
  <params>
    <param name="suspensionKey">suspension</param>
    <param name="manualDaysSuspendedKey">daysSuspended</param>
    <param name="manualType">M</param>  <!-- fine type for manual fines -->

    <!-- considerSkipDays: false(default): compute contiguous days.
                           true: skip the closed-library days (skipDays), giving a total of
                           suspended days possibly greater than the number of contiguous days.
    -->
    <param name="considerSkipDays">true</param>

    <!-- tailSuspensions: false(default). All suspensions are applied starting now, possibly overlapping with
                          other suspensions.
                          true: A new suspension starts after the end date of the latest ending suspension.
    -->
    <param name="tailSuspensions">true</param>

    <!-- These two are keys into the transaction extras -->
    <param name="operatorIdExtrasKey">operatorId</param>
    <param name="operatorLocationExtrasKey">operatorLocation</param>
  </params>
</process>

<rule class="net.kalio.empweb.engine.rules.AddTransactionToStatus" name="AddSuspensionToStatus">
  <params>
    <param name="transactionKey">suspension</param>
    <param name="toObjectStatus">false</param>
  </params>
</rule>


<process class="net.kalio.empweb.engine.rules.UpdateDb" name="UpdateDb">
  <doc>Updates User/Object Status databases, and stores Suspension to transaction log.</doc>
  <params>
   <param name="transactionKeys">suspension</param>
   <param name="storeUserStatus">true</param>
   <param name="storeObjectStatus">false</param>
  </params>
</process>

<process class="net.kalio.empweb.engine.rules.ReturnTransactionResults" name="ReturnTransactionResults">
  <params>
    <param name="resultKeys">suspension</param>
  </params>
</process>
<finally class="net.kalio.empweb.engine.rules.Unlock" name="Unlock">
  <doc>Release the logic locks done at the beginning.</doc>
</finally></transaction>